1467829015764,佐藤,2051
1467829015764,それで,2102
1467829015764,それでは,2178
1467829015764,それでは今日,2436
1467829015764,それでは今日行け,2819
1467829015764,それでは今日何時に,3106
1467829015764,それでは良い1日,3202
1467829015764,それでは良い一日の,3472
1467829015764,それでは今日一日何,3596
1467829015764,それでは今日1時7分,3616
1467829015764,それでは良い一日の振り,3738
1467829015764,それでは良い一日のアフリカ,3858
1467829015764,それでは良い一日の振替,3984
1467829015764,それでは今日1日の振り返り,4117
1467829015764,それでは今日1日の振り返りの,4379
1467829015764,それでは今日1日の振り返りのた,4514
1467829015764,それでは今日1日の振り返りのため,4641
1467829015764,それでは今日1日の振り返りのための,4775
1467829015764,それでは今日1日の振り返りのための言う,5481
1467829015764,それでは今日1日の振り返りのための有価,5574
1467829015764,それでは今日1日の振り返りのための誘拐,5838
1467829015764,それでは今日1日の振り返りのための誘拐を,5873
1467829015764,それでは今日1日の振り返りのための有価予報,5968
1467829015764,それでは今日1日の振り返りのための誘拐を恥じ,6093
1467829015764,それでは今日1日の振り返りのための誘拐を始め,6233
1467829015764,それでは今日1日の振り返りのための誘拐を始めま,6360
1467829015764,それでは今日1日の振り返りのための誘拐をはじめます,6487
1467829015764,それでは今日1日の振り返りのための誘拐を始めます,7417